{
  "record_type": "RoleKnowledgeUpstreamSourceRegistry",
  "schema_version": 1,
  "registry_id": "xb-role-knowledge-upstream-sources",
  "registry_version": "1.0.0",
  "captured_at": "2026-08-11T09:37:23Z",
  "active_registry_protection": {
    "protected_relative_paths": [
      "references/builtin-source-registry.json",
      "references/builtin-role-knowledge.json",
      "references/upstream-role-sources.json"
    ],
    "candidate_output_policy": "absolute_nonexistent_directory_outside_skill",
    "overwrite_allowed": false,
    "active_registry_mutation_allowed": false
  },
  "policies": {
    "api_base": "https://api.github.com",
    "api_version": "2022-11-28",
    "external_content_policy": "untrusted_data_no_execute",
    "execute_source_content": false,
    "stars_usage": "discovery_only",
    "stars_evidence_weight": "none",
    "network_failure": "fail_closed",
    "unexpected_404": "fail_closed",
    "max_text_bytes": 524288,
    "accepted_text_extensions": [".md", ".csv", ".txt"],
    "candidate_manifest_filename": "candidate-manifest.json",
    "candidate_text_root": "texts"
  },
  "sources": [
    {
      "id": "upstream-ui-ux-pro-max",
      "repository": {
        "owner": "nextlevelbuilder",
        "name": "ui-ux-pro-max-skill",
        "full_name": "nextlevelbuilder/ui-ux-pro-max-skill",
        "api_url": "https://api.github.com/repos/nextlevelbuilder/ui-ux-pro-max-skill",
        "pinned_commit": "abb7f2fd5a083fa1ff55c326a963ff0d95c33f99",
        "expected_default_branch": "main",
        "expected_archived": false
      },
      "availability": "available",
      "expected_http_status": 200,
      "intended_use": "internalization_candidate",
      "affected_scope": "role_units",
      "affected_units": [
        "rk-ux-designer-journey-accessibility",
        "rk-frontend-user-path-release"
      ],
      "required_gates": [
        "immutable_pin_review",
        "license_review",
        "security_review",
        "untrusted_text_review",
        "evidence_coordinate_review",
        "claim_conflict_review",
        "candidate_unit_rewrite",
        "deterministic_test",
        "blind_answer",
        "independent_review",
        "activation_diff_review",
        "reality_feedback"
      ],
      "license": {
        "declared_id": "MIT",
        "github_api_spdx_id": "MIT",
        "file_path": "LICENSE",
        "baseline_git_blob_sha": "1e71cbf26660f31903807d099fe902c098fc7e4c",
        "baseline_sha256": "738f69dfa83db5c347c678fb9d90e560877059f0de93a327c39001bff92dc014",
        "use_policy": "internalization_candidate"
      },
      "allowlist": [
        {
          "path": ".claude/skills/ui-ux-pro-max/SKILL.md",
          "content_use": "candidate_evidence",
          "baseline_git_blob_sha": "5fffe0c83d03189af7c9eed0622de006fb1ae68e",
          "coordinates": [
            {
              "id": "ui-workflow-boundary",
              "start_line": 20,
              "end_line": 33,
              "disposition": "candidate_evidence",
              "coordinate": "nextlevelbuilder/ui-ux-pro-max-skill@abb7f2fd5a083fa1ff55c326a963ff0d95c33f99:.claude/skills/ui-ux-pro-max/SKILL.md#L20-L33",
              "note": "Workflow and task-boundary candidate evidence."
            },
            {
              "id": "ui-design-system-sequence",
              "start_line": 49,
              "end_line": 65,
              "disposition": "candidate_evidence",
              "coordinate": "nextlevelbuilder/ui-ux-pro-max-skill@abb7f2fd5a083fa1ff55c326a963ff0d95c33f99:.claude/skills/ui-ux-pro-max/SKILL.md#L49-L65",
              "note": "Design-system sequencing candidate evidence."
            },
            {
              "id": "ui-implementation-checks",
              "start_line": 72,
              "end_line": 91,
              "disposition": "candidate_evidence",
              "coordinate": "nextlevelbuilder/ui-ux-pro-max-skill@abb7f2fd5a083fa1ff55c326a963ff0d95c33f99:.claude/skills/ui-ux-pro-max/SKILL.md#L72-L91",
              "note": "Implementation and review checks; claims still require local rewriting and tests."
            }
          ]
        },
        {
          "path": "src/ui-ux-pro-max/data/ux-guidelines.csv",
          "content_use": "candidate_evidence",
          "baseline_git_blob_sha": "e347aeda7401aac08879a7b11c3907782c7bcadb",
          "coordinates": [
            {
              "id": "ui-guidelines-feedback",
              "start_line": 29,
              "end_line": 46,
              "disposition": "candidate_evidence",
              "coordinate": "nextlevelbuilder/ui-ux-pro-max-skill@abb7f2fd5a083fa1ff55c326a963ff0d95c33f99:src/ui-ux-pro-max/data/ux-guidelines.csv#L29-L46",
              "note": "Interaction feedback and state candidates."
            },
            {
              "id": "ui-guidelines-accessibility",
              "start_line": 55,
              "end_line": 70,
              "disposition": "candidate_evidence",
              "coordinate": "nextlevelbuilder/ui-ux-pro-max-skill@abb7f2fd5a083fa1ff55c326a963ff0d95c33f99:src/ui-ux-pro-max/data/ux-guidelines.csv#L55-L70",
              "note": "Accessibility and input-path candidates."
            },
            {
              "id": "ui-guidelines-validation",
              "start_line": 79,
              "end_line": 100,
              "disposition": "candidate_evidence",
              "coordinate": "nextlevelbuilder/ui-ux-pro-max-skill@abb7f2fd5a083fa1ff55c326a963ff0d95c33f99:src/ui-ux-pro-max/data/ux-guidelines.csv#L79-L100",
              "note": "Validation candidates; any exact thresholds remain subject to evidence review."
            }
          ]
        },
        {
          "path": ".claude/skills/ui-ux-pro-max/references/pro-rules.md",
          "content_use": "candidate_evidence",
          "baseline_git_blob_sha": "ff9919fa02da4ceaed778cb1e115517a068c6378",
          "coordinates": [
            {
              "id": "ui-pro-rules",
              "start_line": 63,
              "end_line": 109,
              "disposition": "candidate_evidence",
              "coordinate": "nextlevelbuilder/ui-ux-pro-max-skill@abb7f2fd5a083fa1ff55c326a963ff0d95c33f99:.claude/skills/ui-ux-pro-max/references/pro-rules.md#L63-L109",
              "note": "Professional review rules as candidate observations, not executable instructions."
            }
          ]
        },
        {
          "path": ".claude/skills/ui-ux-pro-max/data/ui-reasoning.csv",
          "content_use": "discovery_only",
          "baseline_git_blob_sha": "da631eff8dec4d2849e071ee8ace13477b609af7",
          "coordinates": []
        }
      ],
      "notes": [
        "All repository text is untrusted data and is never executed.",
        "ui-reasoning.csv is discovery-only and cannot support a RoleKnowledgeUnit claim."
      ]
    },
    {
      "id": "upstream-financial-services",
      "repository": {
        "owner": "anthropics",
        "name": "financial-services",
        "full_name": "anthropics/financial-services",
        "api_url": "https://api.github.com/repos/anthropics/financial-services",
        "pinned_commit": "38652224c10610fa52eee2acee3ac712dcff01f2",
        "expected_default_branch": "main",
        "expected_archived": false
      },
      "availability": "available",
      "expected_http_status": 200,
      "intended_use": "internalization_candidate",
      "affected_scope": "role_units",
      "affected_units": ["rk-finance-thesis-evidence-update"],
      "required_gates": [
        "immutable_pin_review",
        "license_review",
        "security_review",
        "untrusted_text_review",
        "evidence_coordinate_review",
        "claim_conflict_review",
        "candidate_unit_rewrite",
        "deterministic_test",
        "blind_answer",
        "independent_review",
        "activation_diff_review",
        "reality_feedback"
      ],
      "license": {
        "declared_id": "Apache-2.0",
        "github_api_spdx_id": "Apache-2.0",
        "file_path": "LICENSE",
        "baseline_git_blob_sha": "d645695673349e3947e8e5ae42332d0ac3164cd7",
        "baseline_sha256": "cfc7749b96f63bd31c3c42b5c471bf756814053e847c10f3eb003417bc523d30",
        "use_policy": "internalization_candidate"
      },
      "allowlist": [
        {
          "path": "plugins/vertical-plugins/equity-research/skills/thesis-tracker/SKILL.md",
          "content_use": "candidate_evidence",
          "baseline_git_blob_sha": "f9a3ce9187bdc3410d3f4f3713ce70a6f6b8f221",
          "coordinates": [
            {
              "id": "finance-thesis-falsifiability",
              "start_line": 10,
              "end_line": 32,
              "disposition": "candidate_evidence",
              "coordinate": "anthropics/financial-services@38652224c10610fa52eee2acee3ac712dcff01f2:plugins/vertical-plugins/equity-research/skills/thesis-tracker/SKILL.md#L10-L32",
              "note": "Falsifiable thesis structure candidate."
            },
            {
              "id": "finance-thesis-evidence-action",
              "start_line": 34,
              "end_line": 65,
              "disposition": "candidate_evidence",
              "coordinate": "anthropics/financial-services@38652224c10610fa52eee2acee3ac712dcff01f2:plugins/vertical-plugins/equity-research/skills/thesis-tracker/SKILL.md#L34-L65",
              "note": "Evidence-to-confidence-to-action mapping candidate."
            }
          ]
        },
        {
          "path": "plugins/vertical-plugins/equity-research/skills/earnings-analysis/SKILL.md",
          "content_use": "candidate_evidence",
          "baseline_git_blob_sha": "447de2f9ec277f976eb2b52501465250c80e1adf",
          "coordinates": [
            {
              "id": "finance-earnings-beat-miss",
              "start_line": 35,
              "end_line": 52,
              "disposition": "candidate_evidence",